id,realtime_start,realtime_end,title,observation_start,observation_end,frequency,frequency_short,units,units_short,seasonal_adjustment,seasonal_adjustment_short,last_updated,popularity,group_popularity,notes
WEI,2025-12-12,2025-12-12,Weekly Economic Index (Lewis-Mertens-Stock),2008-01-05,2025-12-06,"Weekly, Ending Saturday",W,Index,Index,Not Seasonally Adjusted,NSA,2025-12-11 10:39:38-06,62,62,"The WEI is an index of real economic activity using timely and relevant high-frequency data. It represents the common component of ten different daily and weekly series covering consumer behavior, the labor market, and production. The WEI is scaled to the four-quarter GDP growth rate; for example, if the WEI reads -2 percent and the current level of the WEI persists for an entire quarter, one would expect, on average, GDP that quarter to be 2 percent lower than a year previously. 

The WEI is a composite of 10 weekly economic indicators: Redbook same-store sales, Rasmussen Consumer Index, new claims for unemployment insurance, continued claims for unemployment insurance, adjusted income/employment tax withholdings (from Booth Financial Consulting), railroad traffic originated (from the Association of American Railroads), the American Staffing Association Staffing Index, steel production, wholesale sales of gasoline, diesel, and jet fuel, and weekly average US electricity load (with remaining data supplied by Haver Analytics). All series are represented as year-over-year percentage changes. These series are combined into a single index of weekly economic activity.

For additional details, including an analysis of the performance of the model, see Lewis, Mertens, and Stock (2020), “U.S. Economic Activity during the Early Weeks of the SARS-Cov-2 Outbreak.” (https://www.newyorkfed.org/research/staff_reports/sr920)

This index has been developed by Daniel Lewis, an economist in the Federal Reserve Bank of New York, Karel Mertens, a senior economic policy advisor at the Federal Reserve Bank of Dallas, and James Stock, the Harold Hitchings Burbank Professor of Political Economy, Faculty of Arts and Sciences of Harvard University.

The index is not an official forecast of the Federal Reserve Bank of New York, its president, the Federal Reserve System, or the Federal Open Market Committee."
PCECC96,2025-12-12,2025-12-12,Real Personal Consumption Expenditures,1947-01-01,2025-04-01,Quarterly,Q,Billions of Chained 2017 Dollars,Bil. of Chn. 2017 $,Seasonally Adjusted Annual Rate,SAAR,2025-09-25 07:47:03-05,62,78,"BEA Account Code: DPCERX

A Guide to the National Income and Product Accounts of the United States (NIPA) - (http://www.bea.gov/national/pdf/nipaguid.pdf)"
FYOIGDA188S,2025-12-12,2025-12-12,Federal Outlays: Interest as Percent of Gross Domestic Product,1940-01-01,2024-01-01,Annual,A,Percent of GDP,% of GDP,Not Seasonally Adjusted,NSA,2025-10-16 14:10:41-05,62,62,"Federal Outlays: Interest as Percent of Gross Domestic Product (FYOIGDA188S) (https://fred.stlouisfed.org/series/FYOIGDA188S) was first constructed by the Federal Reserve Bank of St. Louis in January 2013. It is calculated using Federal Outlays: Interest (FYOINT) (https://fred.stlouisfed.org/series/FYOINT) and Gross Domestic Product (GDPA) (https://fred.stlouisfed.org/series/GDPA):
FYOIGDA188S = ((FYOINT/1000)/GDPA)*100
FYOINT/1000 transforms FYOINT from millions of dollars to billions of dollars."
NETEXP,2025-12-12,2025-12-12,Net Exports of Goods and Services,1947-01-01,2025-04-01,Quarterly,Q,Billions of Dollars,Bil. of $,Seasonally Adjusted Annual Rate,SAAR,2025-09-25 07:48:08-05,62,62,"BEA Account Code: A019RC

A Guide to the National Income and Product Accounts of the United States (NIPA) - (http://www.bea.gov/national/pdf/nipaguid.pdf)"
W006RC1Q027SBEA,2025-12-12,2025-12-12,Federal government current tax receipts,1947-01-01,2025-04-01,Quarterly,Q,Billions of Dollars,Bil. of $,Seasonally Adjusted Annual Rate,SAAR,2025-09-25 07:47:04-05,62,62,"BEA Account Code: W006RC

Visit the BEA (http://www.bea.gov/national/) for more information about this series."
JHGDPBRINDX,2025-12-12,2025-12-12,GDP-Based Recession Indicator Index,1967-10-01,2025-01-01,Quarterly,Q,Percentage Points,Percentage Points,Not Seasonally Adjusted,NSA,2025-07-30 19:01:03-05,61,60,"This index measures the probability that the U.S. economy was in a recession during the indicated quarter. It is based on a mathematical description of the way that recessions differ from expansions. The index corresponds to the probability (measured in percent) that the underlying true economic regime is one of recession based on the available data. Whereas the NBER business cycle dates are based on a subjective assessment of a variety of indicators that may not be released until several years after the event, this index is entirely mechanical, is based solely on currently available GDP data and is reported every quarter. Due to the possibility of data revisions and the challenges in accurately identifying the business cycle phase, the index is calculated for the quarter just preceding the most recently available GDP numbers. Once the index is calculated for that quarter, it is never subsequently revised. The value at every date was inferred using only data that were available one quarter after that date and as those data were reported at the time.

If the value of the index rises above 67% that is a historically reliable indicator that the economy has entered a recession. Once this threshold has been passed, if it falls below 33% that is a reliable indicator that the recession is over.

For more information about this series visit http://econbrowser.com/recession-index."
M318501Q027NBEA,2025-12-12,2025-12-12,Federal government budget surplus or deficit (-),1959-07-01,2023-10-01,Quarterly,Q,Billions of Dollars,Bil. of $,Not Seasonally Adjusted,NSA,2024-12-19 07:54:03-06,61,61,"BEA Account Code: M318501

For more information about this series, please see http://www.bea.gov/national/."
DPCERE1Q156NBEA,2025-12-12,2025-12-12,Shares of gross domestic product: Personal consumption expenditures,1947-01-01,2025-04-01,Quarterly,Q,Percent,%,Not Seasonally Adjusted,NSA,2025-09-25 07:47:05-05,61,60,"BEA Account Code: DPCERE

For more information about this series, please see http://www.bea.gov/national/."
MKTGDPCNA646NWDB,2025-12-12,2025-12-12,Gross Domestic Product for China,1960-01-01,2024-01-01,Annual,A,Current U.S. Dollars,Current $,Not Seasonally Adjusted,NSA,2025-07-02 13:56:02-05,60,60,"GDP at purchaser's prices is the sum of gross value added by all resident producers in the economy plus any product taxes and minus any subsidies not included in the value of the products. It is calculated without making deductions for depreciation of fabricated assets or for depletion and degradation of natural resources. Data are in current U.S. dollars. Dollar figures for GDP are converted from domestic currencies using single year official exchange rates. For a few countries where the official exchange rate does not reflect the rate effectively applied to actual foreign exchange transactions, an alternative conversion factor is used.

Source Code: NY.GDP.MKTP.CD"
GDPCA,2025-12-12,2025-12-12,Real Gross Domestic Product,1929-01-01,2024-01-01,Annual,A,Billions of Chained 2017 Dollars,Bil. of Chn. 2017 $,Not Seasonally Adjusted,NSA,2025-09-25 07:47:04-05,60,94,"BEA Account Code: A191RX

A Guide to the National Income and Product Accounts of the United States (http://www.bea.gov/national/pdf/nipaguid.pdf) (NIPA)"
GNP,2025-12-12,2025-12-12,Gross National Product,1947-01-01,2025-04-01,Quarterly,Q,Billions of Dollars,Bil. of $,Seasonally Adjusted Annual Rate,SAAR,2025-09-25 07:48:08-05,60,60,"BEA Account Code: A001RC

A Guide to the National Income and Product Accounts of the United States (NIPA) - (http://www.bea.gov/national/pdf/nipaguid.pdf)"
IMPGS,2025-12-12,2025-12-12,Imports of Goods and Services,1947-01-01,2025-04-01,Quarterly,Q,Billions of Dollars,Bil. of $,Seasonally Adjusted Annual Rate,SAAR,2025-09-25 07:48:09-05,60,62,"BEA Account Code: B021RC

A Guide to the National Income and Product Accounts of the United States (NIPA) - (http://www.bea.gov/national/pdf/nipaguid.pdf)"
JPNNGDP,2025-12-12,2025-12-12,Gross Domestic Product for Japan,1994-01-01,2025-07-01,Quarterly,Q,Billions of Yen,Bil. of Yen,Seasonally Adjusted,SA,2025-12-07 17:52:48-06,59,60,"Copyright, 2016, Cabinet Office of Japan."
FYGFGDQ188S,2025-12-12,2025-12-12,Federal Debt Held by the Public as Percent of Gross Domestic Product,1970-01-01,2025-04-01,Quarterly,Q,Percent of GDP,% of GDP,Seasonally Adjusted,SA,2025-09-25 07:58:06-05,59,58,"Federal Debt Held by the Public as Percent of Gross Domestic Product (FYGFGDQ188S) (https://fred.stlouisfed.org/series/FYGFGDQ188S) was first constructed by the Federal Reserve Bank of St. Louis in October 2012. It is calculated using Federal Debt Held by the Public (FYGFDPUN) (https://fred.stlouisfed.org/series/FYGFDPUN) and Gross Domestic Product, 1 Decimal (GDP) (https://fred.stlouisfed.org/series/GDP):
FYGFGDQ188S = ((FYGFDPUN/1000)/GDP)*100
FYGFDPUN/1000 transforms FYGFDPUN from millions of dollars to billions of dollars."
VAPGDPMA,2025-12-12,2025-12-12,Value Added by Industry: Manufacturing as a Percentage of GDP,2005-01-01,2025-04-01,Quarterly,Q,Percent,%,Not Seasonally Adjusted,NSA,2025-09-25 07:31:01-05,58,58,"Value added represents the sum of the costs-incurred and the incomes-earned in production, and consists of compensation of employees, taxes on production and imports, less subsidies, and gross operating surplus.

This product uses the Bureau of Economic Analysis (BEA) Data API but is not endorsed or certified by BEA."
W068RCQ027SBEA,2025-12-12,2025-12-12,Government total expenditures,1960-01-01,2025-04-01,Quarterly,Q,Billions of Dollars,Bil. of $,Seasonally Adjusted Annual Rate,SAAR,2025-09-25 07:47:06-05,58,58,"BEA Account Code: W068RC

A Guide to the National Income and Product Accounts of the United States (NIPA) - (http://www.bea.gov/national/pdf/nipaguid.pdf)"
FYFSDFYGDP,2025-12-12,2025-12-12,Federal Surplus or Deficit [-] as Percent of Gross Domestic Product,1930-06-30,2023-09-30,"Annual, Fiscal Year",A,Percent of GDP,% of GDP,Not Seasonally Adjusted,NSA,2024-10-18 16:11:03-05,58,77,
